[
  {
    "id": "men.a.stoke-the-pyre",
    "name": "Stoke the Pyre",
    "text": "Friendly Menoth models in this model's CTRL may burn the fire off an enemy to boost one melee attack or damage roll against it. This model may burn fire off an enemy in her CTRL to cast a spell for free.",
    "kind": "aura",
    "trigger": "passive",
    "effect": [
      {
        "op": "grantAbility",
        "ability": "men.a.stoke-boost-attack"
      },
      {
        "op": "grantAbility",
        "ability": "men.a.stoke-boost-damage"
      }
    ],
    "scope": {
      "who": "friendly",
      "range": "CTRL",
      "filter": {
        "test": "keyword",
        "value": "menoth"
      }
    },
    "duration": "continuous"
  },
  {
    "id": "men.a.stoke-boost-attack",
    "name": "Stoke the Pyre (attack)",
    "text": "Granted: against an enemy on fire, strip the fire to add a die to a melee attack roll. Used on the attack only when the hit is a long shot; otherwise the fire is kept for damage.",
    "kind": "triggered",
    "trigger": "attack.beforeRoll",
    "when": {
      "all": [
        {
          "test": "attackKind",
          "value": "melee"
        },
        {
          "test": "hasCondition",
          "subject": "target",
          "value": "fire"
        }
      ]
    },
    "effect": [
      {
        "code": "stokeStripAttack"
      },
      {
        "op": "addDie",
        "roll": "attack"
      }
    ],
    "scope": {
      "who": "self"
    },
    "duration": "instant"
  },
  {
    "id": "men.a.stoke-boost-damage",
    "name": "Stoke the Pyre (damage)",
    "text": "Granted: against an enemy on fire, strip the fire to add a die to a melee damage roll.",
    "kind": "triggered",
    "trigger": "damage.beforeRoll",
    "when": {
      "all": [
        {
          "test": "attackKind",
          "value": "melee"
        },
        {
          "test": "hasCondition",
          "subject": "target",
          "value": "fire"
        }
      ]
    },
    "effect": [
      {
        "code": "stokeStripDamage"
      },
      {
        "op": "addDie",
        "roll": "damage"
      }
    ],
    "scope": {
      "who": "self"
    },
    "duration": "instant"
  },
  {
    "id": "men.a.incite-link",
    "name": "Incite Link",
    "text": "Carries the attack bonus of the Incite spell to friendly Menoth models while this model lives.",
    "kind": "aura",
    "trigger": "passive",
    "effect": [
      {
        "op": "grantAbility",
        "ability": "men.a.incite-attack"
      }
    ],
    "scope": {
      "who": "friendly",
      "filter": {
        "test": "keyword",
        "value": "menoth"
      }
    },
    "duration": "continuous"
  },
  {
    "id": "men.a.incite-attack",
    "name": "Incite (attack)",
    "text": "While Incite is up, attack rolls against enemies close to its caster get +2.",
    "kind": "triggered",
    "trigger": "attack.beforeRoll",
    "effect": [
      {
        "code": "inciteAttack"
      }
    ],
    "scope": {
      "who": "self"
    },
    "duration": "instant"
  },
  {
    "id": "men.a.critical-fire",
    "name": "Critical Fire",
    "text": "A critical hit sets the target on fire.",
    "kind": "triggered",
    "trigger": "attack.crit",
    "effect": [
      {
        "op": "applyCondition",
        "condition": "fire"
      }
    ],
    "scope": {
      "who": "target"
    },
    "duration": "instant"
  },
  {
    "id": "men.a.continuous-fire",
    "name": "Continuous Effect: Fire",
    "text": "A hit sets the target on fire.",
    "kind": "triggered",
    "trigger": "attack.hit",
    "effect": [
      {
        "op": "applyCondition",
        "condition": "fire"
      }
    ],
    "scope": {
      "who": "target"
    },
    "duration": "instant"
  },
  {
    "id": "men.a.chain-weapon",
    "name": "Chain Weapon",
    "text": "Ignores the ARM bonus of a Buckler, a Shield and Shield Wall on the target.",
    "kind": "triggered",
    "trigger": "attack.declared",
    "effect": [
      {
        "op": "ignore",
        "ignore": "shieldBonuses"
      }
    ],
    "scope": {
      "who": "self"
    },
    "duration": "instant"
  },
  {
    "id": "men.a.set-defense",
    "name": "Set Defense",
    "text": "Charge attack rolls and slam rolls against this model take -2.",
    "kind": "passive",
    "trigger": "passive",
    "effect": [
      {
        "code": "coreFlag",
        "params": {
          "flag": "setDefense"
        }
      }
    ],
    "scope": {
      "who": "self"
    },
    "duration": "continuous"
  },
  {
    "id": "men.a.steady",
    "name": "Steady",
    "text": "This model cannot be knocked down.",
    "kind": "passive",
    "trigger": "passive",
    "effect": [
      {
        "op": "forbid",
        "what": "knockDown"
      }
    ],
    "scope": {
      "who": "self"
    },
    "duration": "continuous"
  },
  {
    "id": "men.a.relentless-charge",
    "name": "Relentless Charge",
    "text": "This model has Pathfinder while it charges.",
    "kind": "passive",
    "trigger": "passive",
    "effect": [
      {
        "op": "grantAbility",
        "ability": "core.a.pathfinder"
      }
    ],
    "scope": {
      "who": "self"
    },
    "duration": "continuous"
  },
  {
    "id": "men.a.impenetrable-shield",
    "name": "Impenetrable Shield",
    "text": "While in base contact with a friendly Flameguard model, this model takes no damage from non-magical melee or ranged attacks.",
    "kind": "passive",
    "trigger": "passive",
    "effect": [
      {
        "code": "coreFlag",
        "params": {
          "flag": "impenetrableShield"
        }
      }
    ],
    "scope": {
      "who": "self"
    },
    "duration": "continuous"
  },
  {
    "id": "men.a.battle-plan",
    "name": "Battle Plan",
    "text": "Once in its activation this model picks a plan for a friendly Menoth warrior model or unit within 5 inches: Fight to the Last, Stir the Blood or Precision Strike.",
    "kind": "triggered",
    "trigger": "activation.end",
    "effect": [
      {
        "code": "battlePlan"
      }
    ],
    "scope": {
      "who": "self"
    },
    "duration": "instant"
  },
  {
    "id": "men.a.fight-to-the-last",
    "name": "Plan: Fight to the Last",
    "text": "The chosen model or unit gains Tough for a round.",
    "kind": "specialAction",
    "trigger": "combat.choose",
    "effect": [
      {
        "op": "grantAbility",
        "ability": "core.a.tough"
      }
    ],
    "scope": {
      "who": "friendly",
      "range": 5,
      "filter": {
        "test": "keyword",
        "value": "menoth"
      }
    },
    "duration": "round"
  },
  {
    "id": "men.a.stir-the-blood",
    "name": "Plan: Stir the Blood",
    "text": "The chosen model or unit gets +2 on its next melee damage roll this turn.",
    "kind": "specialAction",
    "trigger": "combat.choose",
    "effect": [
      {
        "op": "modRoll",
        "roll": "damage",
        "value": 2
      }
    ],
    "scope": {
      "who": "friendly",
      "range": 5,
      "filter": {
        "test": "keyword",
        "value": "menoth"
      }
    },
    "duration": "turn"
  },
  {
    "id": "men.a.precision-strike",
    "name": "Plan: Precision Strike",
    "text": "For a turn, friendly models within 10 inches ignore other friendly models for line of sight and may move through them if they end clear.",
    "kind": "specialAction",
    "trigger": "combat.choose",
    "effect": [
      {
        "op": "ignore",
        "ignore": "friendlyModels"
      }
    ],
    "scope": {
      "who": "friendly",
      "range": 10,
      "filter": {
        "test": "keyword",
        "value": "menoth"
      }
    },
    "duration": "turn"
  },
  {
    "id": "men.a.combined-melee-attack",
    "name": "Combined Melee Attack",
    "text": "Models of this unit in melee range may combine their attacks: one makes the attack and each extra participant adds +1 to its attack and damage rolls.",
    "kind": "passive",
    "trigger": "passive",
    "effect": [
      {
        "code": "coreFlag",
        "params": {
          "flag": "combinedMeleeAttack"
        }
      }
    ],
    "scope": {
      "who": "self"
    },
    "duration": "continuous"
  }
]
